{
  "schema_version": 1,
  "step_classes": [
    { "class": "gate_model_step", "members": ["review_artifact", "review_disposition", "review_candidate", "judge"], "derivation": "listed" }
  ],
  "park_reasons": [
    {
      "code": "acceptance_missing",
      "named_at": ["accept_staging"],
      "named_at_classes": [],
      "closed_by": "docs/contracts/epic-staging.md",
      "producer": "daemon",
      "producer_files": []
    },
    {
      "code": "gate_provider_unavailable",
      "named_at": ["freeze_the_artifact"],
      "named_at_classes": ["retry_step"],
      "closed_by": "docs/contracts/tickets-manifest.md",
      "producer": "host",
      "producer_files": ["src/host/nothing-names-this.mjs"]
    },
    {
      "code": "park_reason_nobody_declared",
      "named_at": ["freeze"],
      "named_at_classes": [],
      "closed_by": "03-technical-plan.md",
      "producer": "daemon",
      "producer_files": []
    }
  ],
  "vocabulary_digest": "0000000000000000000000000000000000000000000000000000000000000000"
}
